{
  "system": "research-assistant",
  "as_of": "2026-10-23",
  "threads_version": "1.0.0",
  "adopted": [
    {
      "id": "M1",
      "layer": "middleware",
      "owner": "assistant team",
      "merged": "2026-10-01",
      "test": "calibration by standing on the monthly sample",
      "review_date": "2027-01-15"
    },
    {
      "id": "M2",
      "layer": "middleware",
      "owner": "assistant team",
      "merged": "2026-10-01",
      "test": "critic search for shared upstream sources",
      "review_date": "2027-01-15"
    },
    {
      "id": "M3",
      "layer": "context",
      "owner": "assistant team",
      "merged": "2026-10-01",
      "test": "probe 1 in the prompt README",
      "review_date": "2027-01-15"
    },
    {
      "id": "M4",
      "layer": "middleware",
      "owner": "assistant team",
      "merged": "2026-10-01",
      "test": "register coverage audit",
      "review_date": "2027-01-15"
    },
    {
      "id": "R4",
      "layer": "middleware",
      "owner": "assistant team",
      "merged": "2026-10-08",
      "test": "replication of rung-2 claims",
      "review_date": "2027-01-15"
    },
    {
      "id": "S3",
      "layer": "middleware",
      "owner": "assistant team",
      "merged": "2026-10-08",
      "test": "accuracy by deliberation label",
      "review_date": "2027-01-15"
    },
    {
      "id": "D4",
      "layer": "middleware",
      "owner": "assistant team",
      "merged": "2026-10-08",
      "test": "D-tag audit",
      "review_date": "2027-01-15"
    }
  ]
}
